{"schema_version":10,"schema":"urn:animsmith:schema:collection-output:10","tool":{"name":"animsmith","version":"0.7.0","source":{"revision":"e4869c3ae4ac666a4cbd68d232efb145bda4b437","dirty":true}},"command":"collection lint","manifest":{"schema":"urn:animsmith:schema:collection-manifest:1","schema_version":1,"collection_id":"com.example.evaluation-v2","input":{"sha256":"28cf58a5ce1f5b64326cbad372d1c5baf29a76ad336327a694d28605d1787349","bytes":654}},"budget":{"id":"urn:animsmith:collection-output-budget:1","max_source_bytes":1073741824,"max_aggregate_source_bytes":17179869184,"max_serialized_bytes":268435456,"max_sources":4096,"max_clips":4096,"max_runtime_sets":4096,"max_aggregate_members":16384,"max_aggregate_work":24576},"summary":{"sources":2,"readable_sources":2,"established_sources":2,"clips":2,"established_clips":2,"runtime_sets":1,"complete_runtime_sets":1,"incomplete":false},"work":{"manifest_rows":5,"runtime_set_members":2,"aggregate_work":7,"primary_source_bytes":3650,"serialized_bytes":25863},"sources":[{"key":"a","locator":"rig-a.gltf","input":{"state":"available","input":{"sha256":"0708c61ec3f8815295de14ab570fe73c95a42b05f9abcb6a2f4290324e84ab92","bytes":1825}},"digest":{"state":"unpinned"},"config":{"state":"explicit","locator":"fixture.animsmith.toml","input":{"sha256":"920face726f0e5540a2436f0fbefbb77febaaecd7d7000a94c3e2cb520d9a912","bytes":40}},"loader":{"state":"ready"},"dependency_closure":{"state":"complete","identity":{"sha256":"636a6ec1ab7ceb27a833ea0c62ec819d425e8529c5623e9b70fec89c5b289ae8","bytes":271}},"take_inventory":"complete","observed_takes":[{"source_take_index":0,"name":{"state":"available","value":"walk"},"normalized":{"state":"available","index":0,"name":"walk"}}],"result":{"state":"available","envelope":{"schema_version":18,"schema":"urn:animsmith:schema:output:18","tool":{"name":"animsmith","version":"0.7.0","source":{"revision":"e4869c3ae4ac666a4cbd68d232efb145bda4b437","dirty":true}},"command":"lint","summary":{"files":1,"findings":{"error":0,"warning":0,"note":0},"checks":{"total":31,"selection":{"selected":31,"unselected":0},"configuration":{"enabled":30,"disabled":1},"applicability":{"applicable":10,"not_applicable":21},"evaluation":{"complete":8,"partial":0,"not_evaluated":23},"gaps":1},"prediction_facets":{"available":0,"required_prediction_unavailable":0}},"files":[{"path":"rig-a.gltf","input":{"sha256":"0708c61ec3f8815295de14ab570fe73c95a42b05f9abcb6a2f4290324e84ab92","bytes":1825},"rig":{"profile":"custom","resolution_outcome":"resolved","resolved_roles":{"hips":"hips","root":"root"},"resolved_role_policies":{"hips":"explicit","root":"explicit"}},"measurements":{"schema_version":17,"schema":"urn:animsmith:schema:measurements:17","clips":{"walk":{"duration_s":1.0,"frame_count":3,"animated_bones":["hips","root"],"bone_channels":[{"bone_index":0,"bone_name":"root","properties":["translation"]},{"bone_index":1,"bone_name":"hips","properties":["rotation"]}],"bone_rotation_range_deg":{"hips":89.99998474121094},"loop_continuity":{"bones":[{"bone_index":0,"bone_name":"root","availability":"measured","position_delta_m":1.0,"rotation_delta_deg":0.0,"seam_velocity_delta_mps":0.0,"seam_angular_velocity_delta_degps":0.0},{"bone_index":1,"bone_name":"hips","availability":"measured","position_delta_m":1.0,"rotation_delta_deg":90.0,"seam_velocity_delta_mps":0.0,"seam_angular_velocity_delta_degps":6.830189249740215e-6},{"bone_index":2,"bone_name":"foot","availability":"measured","position_delta_m":1.0,"rotation_delta_deg":90.0,"seam_velocity_delta_mps":0.0,"seam_angular_velocity_delta_degps":6.830189249740215e-6}]},"loop_continuity_availability":"measured","loop_endpoint_mode_availability":"not_applicable","frame_grid_availability":"not_applicable","loop_seam_ratio_availability":"not_applicable","gait_availability":"not_applicable","root_trajectory":{"bone_index":0,"bone_name":"root","source_role":"root","translation":{"horizontal_displacement_x_m":0.0,"horizontal_displacement_z_m":1.0,"horizontal_travel_m":1.0,"vertical_displacement_m":0.0,"vertical_min_displacement_m":0.0,"vertical_max_displacement_m":0.0},"translation_availability":"measured","yaw":{"heading_axis":"positive_z","net_yaw_deg":0.0,"unwrapped_yaw_deg":0.0,"yaw_travel_deg":0.0},"yaw_availability":"measured"},"root_trajectory_availability":"measured","speed_mps":1.0,"speed_mps_availability":"measured"}},"material_resource_coverage":"complete","material_definitions":[],"textures":[],"images":[],"skeleton_source_coverage":"complete","skeleton_nodes":[{"node_index":0,"name":"root","scene_root_indices":[0],"local_rest":{"kind":"trs","translation_parent_space_m":[0.0,0.0,0.0],"rotation_xyzw":[0.0,0.0,0.0,1.0],"scale":[1.0,1.0,1.0]},"rest_world_matrix":[1.0,0.0,0.0,0.0,0.0,1.0,0.0,0.0,0.0,0.0,1.0,0.0,0.0,0.0,0.0,1.0],"rest_world_translation_m":[0.0,0.0,0.0],"rest_world_linear":{"classification":"unit_orthonormal","axis_lengths":[1.0,1.0,1.0],"determinant":1.0,"orientation":"positive","uniform_scale":1.0}},{"node_index":1,"name":"hips","parent_node_index":0,"scene_root_indices":[],"local_rest":{"kind":"trs","translation_parent_space_m":[0.0,1.0,0.0],"rotation_xyzw":[0.0,0.0,0.0,1.0],"scale":[1.0,1.0,1.0]},"rest_world_matrix":[1.0,0.0,0.0,0.0,0.0,1.0,0.0,0.0,0.0,0.0,1.0,0.0,0.0,1.0,0.0,1.0],"rest_world_translation_m":[0.0,1.0,0.0],"rest_world_linear":{"classification":"unit_orthonormal","axis_lengths":[1.0,1.0,1.0],"determinant":1.0,"orientation":"positive","uniform_scale":1.0}},{"node_index":2,"name":"foot","parent_node_index":1,"scene_root_indices":[],"local_rest":{"kind":"trs","translation_parent_space_m":[0.0,-1.0,0.0],"rotation_xyzw":[0.0,0.0,0.0,1.0],"scale":[1.0,1.0,1.0]},"rest_world_matrix":[1.0,0.0,0.0,0.0,0.0,1.0,0.0,0.0,0.0,0.0,1.0,0.0,0.0,0.0,0.0,1.0],"rest_world_translation_m":[0.0,0.0,0.0],"rest_world_linear":{"classification":"unit_orthonormal","axis_lengths":[1.0,1.0,1.0],"determinant":1.0,"orientation":"positive","uniform_scale":1.0}}],"skins":[],"mesh_definitions":[],"node_instances":[],"scenes":[{"scene_index":0,"instance_count":0,"excluded_instance_count":0}],"default_scene_index":0},"prediction_provenance":null,"checks":[{"check_id":"nan","selection":"selected","configuration":"enabled","applicability":"applicable","evaluation":"complete","findings":[]},{"check_id":"time-monotonic","selection":"selected","configuration":"enabled","applicability":"applicable","evaluation":"complete","findings":[]},{"check_id":"quat-norm","selection":"selected","configuration":"enabled","applicability":"applicable","evaluation":"complete","findings":[]},{"check_id":"quat-flip","selection":"selected","configuration":"enabled","applicability":"applicable","evaluation":"complete","findings":[]},{"check_id":"duration-sanity","selection":"selected","configuration":"enabled","applicability":"applicable","evaluation":"complete","findings":[]},{"check_id":"scale-keys","selection":"selected","configuration":"enabled","applicability":"applicable","evaluation":"complete","findings":[]},{"check_id":"non-uniform-scale","selection":"selected","configuration":"enabled","applicability":"applicable","evaluation":"complete","findings":[]},{"check_id":"constant-nonunit-scale","selection":"selected","configuration":"disabled","applicability":"applicable","evaluation":"not_evaluated","findings":[]},{"check_id":"constant-track","selection":"selected","configuration":"enabled","applicability":"applicable","evaluation":"complete","findings":[]},{"check_id":"required-bones","selection":"selected","configuration":"enabled","applicability":"not_applicable","evaluation":"not_evaluated","findings":[]},{"check_id":"rest-world-scale","selection":"selected","configuration":"enabled","applicability":"not_applicable","evaluation":"not_evaluated","findings":[]},{"check_id":"missing-bones","selection":"selected","configuration":"enabled","applicability":"not_applicable","evaluation":"not_evaluated","findings":[]},{"check_id":"frozen-bone","selection":"selected","configuration":"enabled","applicability":"not_applicable","evaluation":"not_evaluated","findings":[]},{"check_id":"duplicate-loop-endpoint","selection":"selected","configuration":"enabled","applicability":"not_applicable","evaluation":"not_evaluated","findings":[]},{"check_id":"loop-closure","selection":"selected","configuration":"enabled","applicability":"not_applicable","evaluation":"not_evaluated","findings":[]},{"check_id":"loop-seam","selection":"selected","configuration":"enabled","applicability":"not_applicable","evaluation":"not_evaluated","findings":[]},{"check_id":"loop-seam-vel","selection":"selected","configuration":"enabled","applicability":"not_applicable","evaluation":"not_evaluated","findings":[]},{"check_id":"loop-seam-rot","selection":"selected","configuration":"enabled","applicability":"not_applicable","evaluation":"not_evaluated","findings":[]},{"check_id":"root-motion-speed","selection":"selected","configuration":"enabled","applicability":"not_applicable","evaluation":"not_evaluated","findings":[]},{"check_id":"gait-group","selection":"selected","configuration":"enabled","applicability":"not_applicable","evaluation":"not_evaluated","findings":[]},{"check_id":"sync-group","selection":"selected","configuration":"enabled","applicability":"not_applicable","evaluation":"not_evaluated","findings":[]},{"check_id":"time-complement","selection":"selected","configuration":"enabled","applicability":"not_applicable","evaluation":"not_evaluated","findings":[]},{"check_id":"in-place","selection":"selected","configuration":"enabled","applicability":"not_applicable","evaluation":"not_evaluated","findings":[]},{"check_id":"fps","selection":"selected","configuration":"enabled","applicability":"not_applicable","evaluation":"not_evaluated","findings":[]},{"check_id":"bind-pose","selection":"selected","configuration":"enabled","applicability":"applicable","evaluation":"not_evaluated","findings":[],"gaps":[{"code":"insufficient_rotation_evidence","message":"only 1 usable first-frame rotation track(